AuthorID,Author,Date,Content,Attachments,Reactions
"282346512065888266","gray27","2026-05-30T18:45:26.2780000+09:00","https://discord.com/channels/1280891177020686347/1386969584166506546/1399218578485542974
割と最近(?)整備したので、まぁ…
パーサーはデジタル庁がなんか頑張ってなかったっけ、あれは標準を提供するだけだっけ","",""
"844251370411786272","wish.f","2026-05-30T20:06:41.7200000+09:00","「着物の着付け教室」
`amenity=training` で `training=fashion`
とかですかね...。
(どこかでマッピングした気がするけど見つけられませんでした)
https://wiki.openstreetmap.org/wiki/JA:Tag:amenity%3Dtraining","","👍 (2)"
"824917397827354634","tom_konda","2026-05-30T20:09:23.9930000+09:00","ドメスティックな習い事でいうと、書道教室のタグもそうですね。
カリグラフィーの文脈から有りそうなのですが、見つけられず。","",""
"844251370411786272","wish.f","2026-05-30T20:09:35.8750000+09:00","`training=kimono` でも10か所あるようです。","",""
"844251370411786272","wish.f","2026-05-30T20:11:49.1240000+09:00","`training=calligraphy`が浜松に31か所、豊川市に2か所ありました…
`training=*` が浜松には多いようで、kimonoも9か所浜松に。","","👀 (1)"
"709289083867758625","alt9800","2026-05-30T20:13:06.7840000+09:00","標準化されてないけど、データ上見分けがつくようにマッピングするといいのですね、なるほど","",""
"709289083867758625","alt9800","2026-05-30T20:14:43.2570000+09:00","むむむ、nameに入れてある...","https://cdn.discordapp.com/attachments/1280905549227102210/1510240034538917898/image.png?ex=6a313023&is=6a2fdea3&hm=bea4e34b5506d8d4affe6301d3fab964b54bbbbe627f5bad30825fb146ad6c1a&","😅 (1)"
"844251370411786272","wish.f","2026-05-30T20:15:07.1160000+09:00","`training=fashion` は日本にはなかったです笑
とはいえ、1か所しかついてない`training=*`もかなり多いので、できれば整えたいところですね。","","👀 (1)"
"739988936092418122","k.sakanoshita","2026-05-30T20:59:42.0300000+09:00","【MappyHourにご参加されるみなさまへ】
MappyHourは、みんなでOpenStreetMapを描いていくイベントです。

近所でも旅先でも、興味が湧いた場所から気楽に描いていきましょう。
まずは、このチャットに「何処を描きたいか」を投稿してみましょう。
大まかな都市名や駅名でOK。描きたいものがあればそれも合わせて！
地図の描き方が分からない人は、以下のサイトを読んでみてください。
それでも分からなければチャットで質問ください。早めに返答します。

LearnOSM（はじめてからのOpenStreetMapガイド）
https://learnosm.org/ja/beginner/

地図を描いている時（マッピング中）、どう描けば良いか分からない
ものが見つかったら、チャットで描き方を一緒に考えていきましょう。
もちろん、描いている時に気が付いたこと、面白い地物などがあれば
どんどんチャットでネタを提供していきましょう。
そして、地図を描いた後は、チャットで成果発表してみませんか？
https://osm.org で描いた辺りを表示して、URLをチャットに書けば
何処をマッピングしたのか、みんなに伝えることが出来ます。
※画面キャプチャを貼り付けるのも良いですねー（Copyright付けてね）
そうそう、地図を保存する時のコメントに「#MappyHourJapan」を
追記したら、以下のサイトのHashtagsランキングに掲載されるかも？

https://osmstats.neis-one.org/

それでは、みなさん楽しくいきましょう。","","👍 (2)"
"709289083867758625","alt9800","2026-05-30T21:04:49.8360000+09:00","福岡県南で仕事で訪れた場所をマッピングしています。主要駅周辺でも道路がぐにゃ〜〜となっていたり...修正中です @久留米市田主丸","https://cdn.discordapp.com/attachments/1280905549227102210/1510252645082992752/image.png?ex=6a313be1&is=6a2fea61&hm=94f144ede05910c1d13fdb17ef46fe5850c8d098bb254d75a3819d2f5347e17c&","👍 (4)"
"739988936092418122","k.sakanoshita","2026-05-30T21:10:48.2370000+09:00","お疲れ様です！これはやりがいありますねー。よろしくお願いします！","","👍 (1)"
"837915872663437332","nmaruichi0129","2026-05-30T22:13:04.3200000+09:00","こんばんは、
本日も70km(69.1km)弱サイクリングしましたが、今回はサーベイ目的ではなく一部のセンサー(心拍とケイデンス)に問題があったのでガーミンストアにいきました。
まさか在庫があるとは思っていませんでした。
公開GPSトレースのファイルに記録されていると思いますが、地図には関係ありません。
その他、安全にサイクリング(サーベイ)するためにボトルをもう一本つけたくてボトルケージを買いました。

先週、報告していたしまなみ海道サイクリングロードの問題は愛媛県側は修正しておきました。
本日は、しまなみ海道サイクリングロードの広島分で気になる部分の修正をしたいと思います。","","👍 (2)"
"1265612705079754807","hokkosha","2026-05-30T22:19:43.8350000+09:00","こんばんは。今日は広島県呉市に来ていますが、中心部は店などのマッピング率が高く、今更初見の観光客に等しい私がマッピングできるようなものがなし。
ということで、別に行く予定も何もないのですが、情島（なさけじま）という離島の建物がマッピングされてなかったので追加してみました。","https://cdn.discordapp.com/attachments/1280905549227102210/1510271494473912413/screenshot_2026-05-30_22-16-38.png?ex=6a30a4af&is=6a2f532f&hm=fa3dbc5c5c0608865e33a0a91cedbd19dd8a05faff60c46d16d68834a5e91c91&","👍 (6)"
"739988936092418122","k.sakanoshita","2026-05-30T22:22:42.8840000+09:00","お疲れ様です。在庫があるのは良かったですね。取り寄せだと何日掛かるか気になりますし。","",""
"739988936092418122","k.sakanoshita","2026-05-30T22:24:47.1470000+09:00","お疲れ様です。呉ですかー。行きたい街だなぁ。楽しんでください！
あれ、情島って二つあるんですかね。
https://www.openstreetmap.org/way/131159704#map=16/34.16171/132.57476","","👀 (1)"
"824917397827354634","tom_konda","2026-05-31T00:02:35.0630000+09:00","今晩は、本日も相模大塚駅の北のエリアの建物形状の修正を進めようと思います。","","👍 (3)"
"824917397827354634","tom_konda","2026-05-31T01:08:59.1690000+09:00","本日の成果です。1ブロックの一部のみ形状修正しました 🏘️ 
https://www.openstreetmap.org/changeset/183406736","https://cdn.discordapp.com/attachments/1280905549227102210/1510314089392373983/image.png?ex=6a30cc5b&is=6a2f7adb&hm=e8dc7c856dc47a4b727f4adbae4271d679e9de93ef126524e00af6528a8da5c1&","👍 (2)"
"844251370411786272","wish.f","2026-05-31T01:09:08.1620000+09:00","こんばんは
引き続き各務原市で建物のトレースなどやってました。
解像度が高い画像があればなぁ。","https://cdn.discordapp.com/attachments/1280905549227102210/1510314126646312960/image.png?ex=6a30cc64&is=6a2f7ae4&hm=2573e4972d77da0479af13a86badd8242d9c345b9a4a6d260c9d57d91e792b1e&","👍 (3)"
"837915872663437332","nmaruichi0129","2026-05-31T01:09:23.7340000+09:00","今回は、しまなみ海道サイクリングロードでは自転車専用道の標識は見てないので `highway=cycleway` や `bicyle=designated` を除去しました。
あと先週編集していた所に公園を追加しました.","https://cdn.discordapp.com/attachments/1280905549227102210/1510314191440056490/image.png?ex=6a30cc73&is=6a2f7af3&hm=be0ddab689d970a544cd1f85e3691e5fc96e3d502a5634a694ee4c9d846e32aa&,https://cdn.discordapp.com/attachments/1280905549227102210/1510314191993438341/image.png?ex=6a30cc73&is=6a2f7af3&hm=dbf59512fb41b7df56c8a1b2b4429474cf2279bdec75efe4a8c0a621da6975ed&","👍 (3)"
"739988936092418122","k.sakanoshita","2026-05-31T01:10:02.2000000+09:00","お疲れ様でした！建物の形が詳細になるのは楽しくなりますね。","","👍 (2)"
"739988936092418122","k.sakanoshita","2026-05-31T01:10:34.0380000+09:00","お疲れ様でした！ボケボケな航空写真だとマッピング厳しいですしね。","",""
"739988936092418122","k.sakanoshita","2026-05-31T01:11:48.9680000+09:00","お疲れ様でした！おー。公園ありがたい。サイクリングロードだけど自転車専用の標識は無いって不思議な気もしますね（そんなものなのかな）","",""
"739988936092418122","k.sakanoshita","2026-05-31T01:12:49.6490000+09:00","今日の昼間、明日の三国マッピングパーティに向けての準備（建物などの詳細化、更新など）してました。","https://cdn.discordapp.com/attachments/1280905549227102210/1510315055734853762/image.png?ex=6a30cd41&is=6a2f7bc1&hm=0baf8501523f1e9910c38fa296d7f0a35fc5920aca83ffa024288af3f13cd673&","👍 (3)"
"709289083867758625","alt9800","2026-05-31T15:01:12.0090000+09:00","引き続きガリガリ書いているのですが、過去、矩形化機能が知られてなかったが故にポリゴンが大きくズレてたりするのをみると、エディタの設計って大事だな〜、ノウハウを多くの人が共有してくれると嬉しいな〜って思いますね。","https://cdn.discordapp.com/attachments/1280905549227102210/1510523522785611846/image.png?ex=6a30e6a8&is=6a2f9528&hm=e8e85dd1ba85167529f8dc99ec757c23c2113e972ea9d2fc5c5d003fd605b3dd&","👍 (3)"
"709289083867758625","alt9800","2026-05-31T15:01:49.4350000+09:00","先人の頑張りをいい感じに修正できた時が一番嬉しいかもしれない","",""
"844251370411786272","wish.f","2026-05-31T22:53:15.8150000+09:00","今日の三国のマッピングパーティーのフォローで、
商店街ひとつ埋めきった...","https://cdn.discordapp.com/attachments/1280905549227102210/1510642321606312039/image.png?ex=6a30ac8b&is=6a2f5b0b&hm=132e693001c924dc2575260e4e8f6b86f52ea1afb446af6858ff00540fc355cf&","👍 (6)"
